{
  "schema_version": "2.0",
  "corpus_id": "foundation-v4-future-activation-v2-heldout",
  "split": "heldout",
  "candidate_independent": true,
  "routing_surface": "fixed-four-adviser",
  "reference_catalog": ["architecture-boundary", "decision-contract", "verification-evidence", "learning-adoption", "decomposition-boundary", "no-change-abstention", "reference-isolation"],
  "cases": [
    {"id":"AQ2-H-001","family_id":"consent-workflow-state-owner","category":"decomposition","mode":"automatic","prompt":"A consent flow has separate agents for intake, review, and notification, but duplicate notices still escape. Propose a lowest-level state owner and stop boundary.","authority":{"effect_authority":false,"claim_authority":false},"condition_blind":true,"labels_visible_to_runner":false,"outcomes_visible_to_authoring":false,"hidden_labels":{"expected_advisers":["agentic-engineering"],"must_not_select":["engineering-learning-loop"],"reference_triggers":["architecture-boundary","decomposition-boundary"]},"near_neighbor_kind":null,"declared_invocation":null},
    {"id":"AQ2-H-002","family_id":"deployment-gate-control-location","category":"decomposition","mode":"automatic","prompt":"A deployment helper can build, publish, and roll back, while a policy check runs only after publication. Recommend where control and approval should be placed without adding a graph.","authority":{"effect_authority":false,"claim_authority":false},"condition_blind":true,"labels_visible_to_runner":false,"outcomes_visible_to_authoring":false,"hidden_labels":{"expected_advisers":["agentic-engineering"],"must_not_select":["codex-task-contract"],"reference_triggers":["architecture-boundary"]},"near_neighbor_kind":null,"declared_invocation":null},
    {"id":"AQ2-H-003","family_id":"intake-routing-simplification","category":"decomposition","mode":"automatic","prompt":"A request intake uses three classifiers before a human sees it, though the only durable distinction is whether an external effect is requested. Suggest a simpler arrangement.","authority":{"effect_authority":false,"claim_authority":false},"condition_blind":true,"labels_visible_to_runner":false,"outcomes_visible_to_authoring":false,"hidden_labels":{"expected_advisers":["agentic-engineering"],"must_not_select":["verification-strategy-engineering"],"reference_triggers":["architecture-boundary","decomposition-boundary"]},"near_neighbor_kind":null,"declared_invocation":null},
    {"id":"AQ2-H-004","family_id":"queue-reconciliation-owner","category":"decomposition","mode":"automatic","prompt":"Two services reconcile the same queue after failures and occasionally overwrite each other’s cursor. Identify the smallest deterministic ownership boundary and recovery rule.","authority":{"effect_authority":false,"claim_authority":false},"condition_blind":true,"labels_visible_to_runner":false,"outcomes_visible_to_authoring":false,"hidden_labels":{"expected_advisers":["agentic-engineering"],"must_not_select":["engineering-learning-loop"],"reference_triggers":["architecture-boundary","decomposition-boundary"]},"near_neighbor_kind":null,"declared_invocation":null},
    {"id":"AQ2-H-005","family_id":"policy-exception-escalation-path","category":"decomposition","mode":"automatic","prompt":"A policy exception request contains factual collection, a risk decision, and a potentially irreversible grant. Lay out the minimum control layers and the named escalation pressure.","authority":{"effect_authority":false,"claim_authority":false},"condition_blind":true,"labels_visible_to_runner":false,"outcomes_visible_to_authoring":false,"hidden_labels":{"expected_advisers":["agentic-engineering"],"must_not_select":["codex-task-contract"],"reference_triggers":["architecture-boundary","decomposition-boundary"]},"near_neighbor_kind":null,"declared_invocation":null},
    {"id":"AQ2-H-006","family_id":"reporting-loop-stop-enforcement","category":"decomposition","mode":"automatic","prompt":"An analytics loop keeps rerunning when a source is unavailable because its success condition is phrased as a narrative. Propose deterministic stop enforcement and an appropriate simpler topology.","authority":{"effect_authority":false,"claim_authority":false},"condition_blind":true,"labels_visible_to_runner":false,"outcomes_visible_to_authoring":false,"hidden_labels":{"expected_advisers":["agentic-engineering"],"must_not_select":["engineering-learning-loop"],"reference_triggers":["architecture-boundary","decomposition-boundary"]},"near_neighbor_kind":null,"declared_invocation":null},
    {"id":"AQ2-H-007","family_id":"invoice-data-request-boundary","category":"task-contract","mode":"automatic","prompt":"A requester wants invoice data cleaned up before a meeting, but has not identified the account set or authority to alter records. Draft a bounded proposed engagement.","authority":{"effect_authority":false,"claim_authority":false},"condition_blind":true,"labels_visible_to_runner":false,"outcomes_visible_to_authoring":false,"hidden_labels":{"expected_advisers":["codex-task-contract"],"must_not_select":["agentic-engineering"],"reference_triggers":["decision-contract"]},"near_neighbor_kind":null,"declared_invocation":null},
    {"id":"AQ2-H-008","family_id":"mobile-redesign-approval-brief","category":"task-contract","mode":"automatic","prompt":"Someone asks to make a mobile screen feel polished. Convert that request into observable outcomes, excluded work, open questions, and a proposed approval threshold.","authority":{"effect_authority":false,"claim_authority":false},"condition_blind":true,"labels_visible_to_runner":false,"outcomes_visible_to_authoring":false,"hidden_labels":{"expected_advisers":["codex-task-contract"],"must_not_select":["verification-strategy-engineering"],"reference_triggers":["decision-contract"]},"near_neighbor_kind":null,"declared_invocation":null},
    {"id":"AQ2-H-009","family_id":"security-finding-remediation-scope","category":"task-contract","mode":"automatic","prompt":"A scan reports a high-severity issue with an unclear exploit path. Define a proposed response boundary that distinguishes reversible investigation from consequential remediation.","authority":{"effect_authority":false,"claim_authority":false},"condition_blind":true,"labels_visible_to_runner":false,"outcomes_visible_to_authoring":false,"hidden_labels":{"expected_advisers":["codex-task-contract"],"must_not_select":["engineering-learning-loop"],"reference_triggers":["decision-contract","reference-isolation"]},"near_neighbor_kind":null,"declared_invocation":null},
    {"id":"AQ2-H-010","family_id":"partner-import-request-clarification","category":"task-contract","mode":"automatic","prompt":"Frame an import request where the file format, duplicate policy, and success evidence are all unstated. Keep the result proposal-only and identify the needed decisions.","authority":{"effect_authority":false,"claim_authority":false},"condition_blind":true,"labels_visible_to_runner":false,"outcomes_visible_to_authoring":false,"hidden_labels":{"expected_advisers":["codex-task-contract"],"must_not_select":["agentic-engineering"],"reference_triggers":["decision-contract"]},"near_neighbor_kind":null,"declared_invocation":null},
    {"id":"AQ2-H-011","family_id":"customer-email-publish-boundary","category":"task-contract","mode":"automatic","prompt":"A draft customer email should explain an outage, but the audience, legal review, and publishing authority are unknown. Propose a compact boundary before drafting final content.","authority":{"effect_authority":false,"claim_authority":false},"condition_blind":true,"labels_visible_to_runner":false,"outcomes_visible_to_authoring":false,"hidden_labels":{"expected_advisers":["codex-task-contract"],"must_not_select":["verification-strategy-engineering"],"reference_triggers":["decision-contract"]},"near_neighbor_kind":null,"declared_invocation":null},
    {"id":"AQ2-H-012","family_id":"metrics-definition-source-boundary","category":"task-contract","mode":"automatic","prompt":"A manager asks for weekly active users, while teams disagree on the event definition. State the proposed source authority, acceptance evidence, and decision needed before analysis begins.","authority":{"effect_authority":false,"claim_authority":false},"condition_blind":true,"labels_visible_to_runner":false,"outcomes_visible_to_authoring":false,"hidden_labels":{"expected_advisers":["codex-task-contract"],"must_not_select":["engineering-learning-loop"],"reference_triggers":["decision-contract","reference-isolation"]},"near_neighbor_kind":null,"declared_invocation":null},
    {"id":"AQ2-H-013","family_id":"token-refresh-failure-oracle","category":"verification","mode":"automatic","prompt":"A token refresh change passes mocked tests but may loop when the provider returns malformed expiry data. Recommend a small oracle and failure-focused evidence set.","authority":{"effect_authority":false,"claim_authority":false},"condition_blind":true,"labels_visible_to_runner":false,"outcomes_visible_to_authoring":false,"hidden_labels":{"expected_advisers":["verification-strategy-engineering"],"must_not_select":["agentic-engineering"],"reference_triggers":["verification-evidence"]},"near_neighbor_kind":null,"declared_invocation":null},
    {"id":"AQ2-H-014","family_id":"attachment-upload-boundary-test","category":"verification","mode":"automatic","prompt":"An attachment upload now scans files before storage. Identify the material wrong behaviors, a proportional boundary check, and evidence that must be refreshed after a deployment change.","authority":{"effect_authority":false,"claim_authority":false},"condition_blind":true,"labels_visible_to_runner":false,"outcomes_visible_to_authoring":false,"hidden_labels":{"expected_advisers":["verification-strategy-engineering"],"must_not_select":["engineering-learning-loop"],"reference_triggers":["verification-evidence"]},"near_neighbor_kind":null,"declared_invocation":null},